First Name,Middle Name,Last Name,Phonetic First Name,Phonetic Middle Name,Phonetic Last Name,Name Prefix,Name Suffix,Nickname,File As,Organization Name,Organization Title,Organization Department,Birthday,Notes,Photo,Labels,Phone 1 - Label,Phone 1 - Value
פזית גוזלן רום נווה ירק אהרונוביץ,,,,,,,,,,,,,,,,* myContacts,Mobile,+972528839760
קרן כהן אריאל נווה ירק אהרונוביץ',,,,,,,,,,,,,,,,* myContacts,Mobile,+972547806040
נעמה חורש מתן אהרונוביץ,,,,,,,,,,,,,,,,* myContacts,Mobile,+972546381281
מאיה ימיני עמית נווה ירק אהרונוביץ,,,,,,,,,,,,,,,,* myContacts,Mobile,+972528330596
 הראל בוארון אמא אהרונוביץ',,,,,,,,,,,,,,,,* myContacts,נייד,+972543321026
ליאת מדר שליו עילאי נווה ירק אהרונוביץ,,,,,,,,,,,,,,,,* myContacts,Mobile,+972507556210
אלינור גמזו אלון אהרונוביץ׳,,,,,,,,,,,,,,,,* myContacts,Mobile,+972546833477